Name,Slug,Collection ID,Locale ID,Item ID,Archived,Draft,Created On,Updated On,Published On,Service Title,Service Subtitle,Service Summary,Service Price,Service Main Image,Service List,Service Description,Service Main Image2,Service Feature List Block One: Smooth Interactions,Service Feature List Block Two: Clear Design,Service Feature List Block Three: Project Documentation,Service Feature List Block Four: Timely Delivery,Meta Description
Cross-Disciplinary Problem Solving,cross-disciplinary-problem-solving-embedded,67fe6c875fd8486d7b051ae9,67fe6c875fd8486d7b051ae8,6821f13984013c91acf0e19e,false,false,Mon May 12 2025 13:01:45 GMT+0000 (Coordinated Universal Time),Thu Jul 17 2025 07:53:42 GMT+0000 (Coordinated Universal Time),Mon Jun 09 2025 13:28:34 GMT+0000 (Coordinated Universal Time),Embedded Systems Cross-Disciplinary Problem Solving,"Bridging hardware, software, and business gaps in complex embedded product development","Rapidly diagnose and resolve integration challenges at the intersection of hardware, software, and business requirements in embedded systems",,,"<ul id=""""><li id="""">Accelerated resolution of hardware-software integration issues</li><li id="""">Enhanced cross-functional team communication mitigating siloes</li><li id="""">Reduced embedded projects delays and cost overruns</li><li id="""">Adaption of technical requirements between different domains</li><li id="""">Technical solutions aligned with business and product objectives</li></ul><p id="""">‍</p>","<p id="""">Embedded system development frequently encounters integration challenges where hardware, software, and business requirements intersect. I specialize in diagnosing these cross-disciplinary issues, identifying root causes, and aligning team priorities to maintain project momentum. For example, when a medical device company experienced system failures due to mismatched hardware data output and software processing, I facilitated collaboration between hardware and software teams, analyzed the data flow, and implemented a solution for reliable, accurate data exchange.</p><p id=""""><strong id="""">Contact me</strong> to resolve your most critical embedded system integration challenges.</p><p id="""">‍</p>",,Faster resolution of complex technical issues,Improved communication and collaboration between teams,Reduced project delays and cost overruns,Alignment of technical solutions with business objectives,"Resolve complex embedded system issues by bridging hardware, software and business, identifying root causes, aligning priorities and ensuring project continuity"
Embedded Process Improvement & Agile Transformation,process-improvement-agile-transformation,67fe6c875fd8486d7b051ae9,67fe6c875fd8486d7b051ae8,6821f0d31d4737e744eeb08c,false,false,Mon May 12 2025 13:00:03 GMT+0000 (Coordinated Universal Time),Wed Jul 16 2025 19:24:25 GMT+0000 (Coordinated Universal Time),Mon Jun 09 2025 13:28:34 GMT+0000 (Coordinated Universal Time),Embedded Process Improvement & Agile Transformation,"Streamline development, implement Agile frameworks, and accelerate CI/CD for embedded product excellence","Transform embedded product development with proven process improvements, Agile adoption, and CI/CD pipeline implementation, delivering faster releases and higher quality",,,"<ul id=""""><li>Strategic Agile and Scrum adoption specifically tailored for embedded software teams.</li><li>Expert design and implementation of robust CI/CD pipelines.</li><li>Comprehensive workflow analysis and targeted process optimization.</li><li>Effective retrospective facilitation and the establishment of continuous improvement planning.</li></ul><p>‍</p>","<p id="""">Inefficient or rigid development processes delay embedded product launches and reduce quality. I help organizations transition to Agile methodologies (such as Scrum or Kanban) and implement CI/CD pipelines to streamline workflows. For example, when a manufacturing company faced slow releases due to waterfall processes, I introduced Agile frameworks, established CI/CD, and trained teams in iterative development, resulting in faster time-to-market and higher product quality. </p><p>‍</p><p id=""""><a href=""/contact"">Contact me</a> to modernize your embedded development process and accelerate delivery.</p>",,Accelerated embedded product delivery through Agile adoption,Higher product quality via CI/CD and iterative testing,Increased team agility and responsiveness with Scrum/Kanban/Scaled Agile,Enhanced cross-functional collaboration and transparency,"Accelerate embedded product delivery through process improvements and Agile, streamlining workflows and team collaboration for faster, high-quality releases"
Embedded Stakeholder Communication & Alignment,stakeholder-communication-alignment,67fe6c875fd8486d7b051ae9,67fe6c875fd8486d7b051ae8,6821f6e410150cfe8ce66e02,false,false,Mon May 12 2025 13:25:56 GMT+0000 (Coordinated Universal Time),Thu Jul 17 2025 07:52:57 GMT+0000 (Coordinated Universal Time),Mon Jun 09 2025 13:28:34 GMT+0000 (Coordinated Universal Time),Embedded Stakeholder Communication & Alignment,"Clarifying expectations and goals, unifying stakeholders, and accelerating decision-making for embedded project success","Align technical, business, and management teams around shared goals, clarify decision-making, and accelerate project delivery through effective stakeholder communication in embedded product development",,,"<ul><li>Facilitation of stakeholder meetings and targeted alignment workshops</li><li>Translation of technical concepts into actionable business terms for decision-makers</li><li>Creation and maintenance of concise, up-to-date project documentation</li><li>Strategic alignment of teams around shared embedded product goals</li></ul>","<p id="""">Effective stakeholder communication and alignment are essential for successful embedded product development. I facilitate structured status updates and regular alignment meetings to clarify expectations among technical, business, and management teams, increase transparency, and accelerate decision-making. For example, when a globally distributed engineering team faced costly misunderstandings between developers and executives, I implemented structured updates and alignment meetings, improving clarity and accelerating project delivery. </p><p>‍</p><p id=""""><strong id="""">Contact me</strong> to align your teams and streamline your embedded product development process.</p>",,Developing tailored communication strategies for diverse audiences,Improved communication and collaboration,Creating clear and concise project documentation,Enhanced technical skills and knowledge sharing,"Optimize embedded project outcomes by clarifying expectations and goals, fostering seamless communication, and ensuring alignment across teams"
Embedded Systems Consulting,embedded-systems-consulting,67fe6c875fd8486d7b051ae9,67fe6c875fd8486d7b051ae8,67fe6c875fd8486d7b051b16,false,false,Tue Aug 20 2024 05:40:24 GMT+0000 (Coordinated Universal Time),Wed Jul 16 2025 19:51:33 GMT+0000 (Coordinated Universal Time),Mon Jun 09 2025 13:28:34 GMT+0000 (Coordinated Universal Time),Embedded Systems Consulting,"Expert guidance for hardware-software integration, architecture, and embedded optimization","Optimize embedded product development with consulting on hardware-software integration, system architecture, and real-time performance to deliver robust, scalable solutions.",,https://cdn.prod.website-files.com/67fe6c875fd8486d7b051aee/6807c88f11e9a7047766e935_what-are-embedded-systems.avif,"<ul id=""""><li>Architecture review and optimization</li><li>Hardware-software interface design</li><li>Real-time data integration and validation</li><li>Performance optimization and validation</li></ul><p>‍</p>","<p id="""">Benefit from expert consulting across all phases of embedded system development, from concept to deployment. I specialize in hardware-software integration, system architecture design, and performance optimization for real-time embedded electronics. Past projects include advising on firmware architecture, debugging complex hardware-software interface issues, and ensuring compliance with industry standards. My actionable insights bridge technical and business needs, guaranteeing your solution is robust and market-ready.</p><p id=""""><strong id="""">Contact us</strong> to transform your embedded designs into successful products</p>",https://cdn.prod.website-files.com/67fe6c875fd8486d7b051aee/67fe6c875fd8486d7b051be2_Ux%20Serice%20Image2.avif,Accelerated hardware-software integration troubleshooting,System architecture design based on proven engineering methodologies,"Expertise in RTOS, embedded firmware, and device driver development","Rigorous testing, validation, and compliance strategies","Expert consulting in embedded systems, hardware-software integration and architecture for robust, scalable solutions to engineering challenges"
Embedded Systems Debugging & Triage,embedded-debugging-triage,67fe6c875fd8486d7b051ae9,67fe6c875fd8486d7b051ae8,6821f6994f2bf3284cf18923,false,false,Mon May 12 2025 13:24:41 GMT+0000 (Coordinated Universal Time),Wed Jul 16 2025 19:19:47 GMT+0000 (Coordinated Universal Time),Mon Jun 09 2025 13:28:34 GMT+0000 (Coordinated Universal Time),Embedded Systems Debugging & Triage,Rapid diagnosis and resolution of critical issues in embedded hardware and software,"Diagnose and resolve critical issues in embedded systems using systematic analysis, advanced debugging, and root cause identification to minimize downtime and ensure reliability.",,,"<ul id=""""><li>Firmware debugging</li><li>Real-time log analysis</li><li>Hardware-software interface triage</li><li>Race condition diagnosis</li><li>Root cause analysis<br><ul><li>Preventative measure implementation</li></ul></li></ul><p id="""">‍</p>","<p id="""">Critical failures in embedded systems and complex software require rapid, expert intervention. My specialized debugging and triage services minimize downtime and restore product reliability through systematic log analysis and advanced debugging techniques. For example, when a client’s device suffered intermittent crashes in deployment, I analyzed system logs, pinpointed a rare firmware race condition, and delivered a robust fix.</p><p id="""">Don't allow critical technical issues to derail your vital embedded project, <a href=""/contact"">contact me</a> to resolve your most critical embedded system issues efficiently and effectively.</p>",,Advanced real-time and embedded system debugging,Systematic root cause analysis and isolation,Expertise in industry-standard debugging tools and methodologies,Implementation of preventative measures for long-term reliability,"Minimize embedded system downtime with rapid issue analysis, debugging, and resolution, leveraging advanced diagnostics and systematic root cause identification"
Product Development & Roadmap Alignment,embedded-product-roadmap-alignment,67fe6c875fd8486d7b051ae9,67fe6c875fd8486d7b051ae8,6821f63f4f2bf3284cf14a04,false,false,Mon May 12 2025 13:23:11 GMT+0000 (Coordinated Universal Time),Wed Jul 16 2025 19:34:39 GMT+0000 (Coordinated Universal Time),Mon Jun 09 2025 13:28:34 GMT+0000 (Coordinated Universal Time),Embedded Product Development & Roadmap Alignment,"Strategic alignment of embedded product vision, business objectives, and technical execution","Define and execute product roadmaps that connect your embedded product vision to business goals and technical milestones for timely, successful launches",,,"<ul id=""""><li id="""">Strategic product roadmap creation and insightful feature prioritization.</li><li id="""">Requirements gathering and stakeholder alignment.<br></li><li>Disciplined release planning and meticulous milestone tracking, specifically for embedded products.</li><li id="""">Expert management of complex dependencies across hardware and software development teams.</li></ul><p id="""">‍</p>","<p id="""">Strategic product success in embedded systems requires careful planning and coordinated execution. I help organizations define actionable, prioritized roadmaps that align embedded product vision with business and technical requirements. For example, when a startup struggled to prioritize features and manage dependencies, I facilitated stakeholder collaboration to develop a phased roadmap, resulting in successful on-time MVP delivery within budget. My expertise in technical planning, test management, and industrialization ensures your product launch is efficient and market-ready.</p><p id="""">‍</p><p id=""""><strong id="""">Contact me</strong> to align your product development with your business goals and transform your embedded product vision into a resounding market success with a clear and actionable roadmap</p>",,Clear definition of embedded product vision and strategy,Actionable prioritization and phased product roadmaps,Alignment of technical and business teams for seamless delivery,Establishment and tracking of metrics for successful product launches,"Align embedded product vision with business goals through strategic roadmapping and technical planning for successful, on-time product launches"
Technical Leadership & Team Coaching,embedded-technical-leadership-coaching,67fe6c875fd8486d7b051ae9,67fe6c875fd8486d7b051ae8,6821efbfa9d3bb7eae71a686,false,false,Mon May 12 2025 12:55:27 GMT+0000 (Coordinated Universal Time),Thu Jul 17 2025 07:54:29 GMT+0000 (Coordinated Universal Time),Mon Jun 09 2025 13:28:34 GMT+0000 (Coordinated Universal Time),Embedded Technical Leadership & Team Coaching,"Coaching, mentoring, and technical leadership for embedded engineering teams","Develop high-performing embedded engineering teams through technical leadership, targeted coaching, and cross-functional communication",,,"<ul id=""""><li id="""">Strategic team mentoring and focused technical skills development</li><li id="""">Interim or fractional technical leadership for critical embedded projects</li><li id="""">Agile coaching and dynamic team workshop facilitation</li><li>Cross-functional conflict resolution and alignment</li></ul><p id="""">‍</p>","<p id="""">Building high-performing embedded engineering teams demands expert leadership and purposeful coaching. I mentor leads, drive Agile and technical skills adoption, and facilitate team workshops to strengthen cross-disciplinary collaboration. For example, when a company moving to Agile faced unclear roles and fragmented teams, I provided structure, led workshops, and established clear communication, resulting in fast delivery and better morale. My approach aligns and motivates teams to thrive on the most complex embedded product challenges.</p><p id=""""><strong id="""">Contact me</strong> to cultivate stronger, more effective engineering teams and elevate your embedded leadership</p>",,Higher embedded team productivity and motivation,"Structured team coaching sessions to break down silos between electronics, firmware, and application disciplines",Accelerated technical skill-building for embedded systems,Faster launch cycles for complex embedded products,"Lead and transform embedded engineering teams with expert technical leadership and coaching for improved collaboration, innovation, and faster product delivery"
